{
  "version": 1,
  "budgets": {
    "tool_calls": {
      "total": null,
      "per_tool": {}
    },
    "tokens": {
      "input": null,
      "output": null,
      "cache_read": null,
      "cache_write": null,
      "total": null
    },
    "turns": null,
    "wall_minutes": null,
    "skills": {
      "count": null,
      "tokens": null
    },
    "mcp_servers": {
      "count": null,
      "tools": null
    },
    "rules": {
      "words": null
    },
    "hooks": {
      "count": null
    },
    "warn_at": 0.8
  },
  "runtime_settings": {},
  "mcp_servers": [],
  "plugins": [],
  "foreign_hooks": [],
  "third_party_skills": [],
  "dependencies": []
}
